<?xml version="1.0" encoding="UTF-8"?>

<employee xmlns:xsi="http://www.w3.org/2001/XMLSchema-instance"
	xsi:noNamespaceSchemaLocation="Employee.xsd">

	<emp>
		<empno>31</empno>
		<name>Madhu</name>
		<salary>15000</salary>
		<band>M</band>
		<doj>2020-05-23</doj>
	</emp>

	<emp>
		<empno>32</empno>
		<name>Soundarraj</name>
		<salary>9000</salary>
		<band>C</band>
		<doj>2020-06-17</doj>
	</emp>

	<emp>
		<empno>33</empno>
		<name>Sri</name>
		<salary>10000</salary>
		<band>E</band>
		<doj>2020-09-22</doj>
	</emp>
	
	<emp>
		<empno>34</empno>
		<name>Hema</name>
		<salary>10000</salary>
		<band>E</band>
		<doj>2020-09-22</doj>
	</emp>
	
	<emp>
		<empno>35</empno>
		<name>Shiva</name>
		<salary>10000</salary>
		<band>E</band>
		<doj>2020-09-22</doj>
	</emp>
	
	<emp>
		<empno>36</empno>
		<name>Booma</name>
		<salary>10000</salary>
		<band>E</band>
		<doj>2020-09-22</doj>
	</emp>
	
	<emp>
		<empno>37</empno>
		<name>Gayathri</name>
		<salary>10000</salary>
		<band>E</band>
		<doj>2020-09-22</doj>
	</emp>
	
	<emp>
		<empno>38</empno>
		<name>Sathish</name>
		<salary>10000</salary>
		<band>E</band>
		<doj>2020-09-22</doj>
	</emp>
	
	<emp>
		<empno>39</empno>
		<name>Dhinesh</name>
		<salary>10000</salary>
		<band>E</band>
		<doj>2020-09-22</doj>
	</emp>
	
	<emp>
		<empno>40</empno>
		<name>Keerthna</name>
		<salary>10000</salary>
		<band>E</band>
		<doj>2020-09-22</doj>
	</emp>

</employee>